<?xml version="1.0" encoding="UTF-8"?>
<!--Sample XML file generated by XMLSpy v2009 sp1 (http://www.altova.com)-->
<Document xsi:schemaLocation="urn:swift:xsd:camt.009.001.04 camt.009.001.04.xsd" xmlns="urn:swift:xsd:camt.009.001.04" xmlns:xsi="http://www.w3.org/2001/XMLSchema-instance">
	<GetLmt>
		<MsgId>
		  <Id>2010090912345666</Id>
		</MsgId>
		<LmtQryDef>
			<LmtCrit>
				<NewCrit>
					<SchCrit>
					   <AcctId>
					     <DmstAcct>
						     <Id>103100000018</Id>
						   </DmstAcct>
						 </AcctId>
					</SchCrit>
				</NewCrit>
			</LmtCrit>
		</LmtQryDef>
	</GetLmt>
</Document>
